{"base_r_commit":"4c92ed7249a91b7dd541fd22dde68b61574556b2","dvc_policy":{"direct_git_artifact_paths":["reports/closure_v1/01_benchmark/benchmark_manifest.json","reports/closure_v1/01_benchmark/benchmark_report.md","reports/closure_v1/01_benchmark/model_comparison_paired.csv","reports/closure_v1/01_benchmark/model_metrics_long.csv","reports/closure_v1/02_site_transfer/fold_assignments.csv","reports/closure_v1/02_site_transfer/generalization_gap.csv","reports/closure_v1/02_site_transfer/location_holdout_metrics.csv","reports/closure_v1/02_site_transfer/site_level_metrics.csv","reports/closure_v1/02_site_transfer/site_transfer_report.md","reports/closure_v1/03_thresholds/rank_stability.csv","reports/closure_v1/03_thresholds/threshold_metrics.csv","reports/closure_v1/03_thresholds/threshold_pairwise_differences.csv","reports/closure_v1/03_thresholds/threshold_prevalence.csv","reports/closure_v1/03_thresholds/threshold_sensitivity_report.md","reports/closure_v1/04_trophic/carlson_reference_metrics.csv","reports/closure_v1/04_trophic/nla_semantic_metrics.csv","reports/closure_v1/04_trophic/trophic_confusion_matrices.csv","reports/closure_v1/04_trophic/trophic_proxy_metrics.csv","reports/closure_v1/04_trophic/trophic_validation_report.md","reports/closure_v1/05_inference/multiplicity_report.csv","reports/closure_v1/05_inference/pairwise_effects.csv","reports/closure_v1/05_inference/site_level_losses.csv","reports/closure_v1/05_inference/statistical_inference_report.md","reports/closure_v1/06_degradation/failure_registry.csv","reports/closure_v1/06_degradation/matched_degradation_metrics.csv","reports/closure_v1/06_degradation/matched_degradation_pairwise.csv","reports/closure_v1/06_degradation/matched_degradation_report.md","reports/closure_v1/06_degradation/robustness_auc.csv","reports/closure_v1/07_anfis_ablation_evaluation/ablation_metrics.csv","reports/closure_v1/07_anfis_ablation_evaluation/ablation_pairwise.csv","reports/closure_v1/07_anfis_ablation_evaluation/anfis_ablation_report.md","reports/closure_v1/07_anfis_ablation_evaluation/anfis_learning_curve.csv","reports/closure_v1/07_anfis_ablation_evaluation/membership_stability.csv","reports/closure_v1/08_uncertainty/conditional_coverage.csv","reports/closure_v1/08_uncertainty/recalibration_comparison.csv","reports/closure_v1/08_uncertainty/reliability_bins.csv","reports/closure_v1/08_uncertainty/uncertainty_ledger.csv","reports/closure_v1/08_uncertainty/uncertainty_report.md","reports/closure_v1/09_planning/ecological_coherence.csv","reports/closure_v1/09_planning/planning_bootstrap.csv","reports/closure_v1/09_planning/planning_inference_report.md","reports/closure_v1/09_planning/planning_sensitivity.csv","reports/closure_v1/10_api/end_to_end_report.md","reports/closure_v1/10_api/environment.json","reports/closure_v1/10_api/openapi.json","reports/closure_v1/10_api/openapi_contract_report.md","reports/closure_v1/10_api/public_tests.xml","reports/closure_v1/10_api/test_report.md"],"dvc_add_after_success_only":true,"dvc_pointer_paths":["data/closure_v1/degradation_masks.parquet.dvc","data/closure_v1/predictions_long.parquet.dvc","reports/closure_v1/05_inference/bootstrap_distributions.parquet.dvc","reports/closure_v1/09_planning/planning_origin_deltas.parquet.dvc"],"dvc_push_after_audit_only":true,"heavy_artifact_paths":["data/closure_v1/degradation_masks.parquet","data/closure_v1/predictions_long.parquet","reports/closure_v1/05_inference/bootstrap_distributions.parquet","reports/closure_v1/09_planning/planning_origin_deltas.parquet"],"implicit_dvc_forbidden":true},"execution_id":"closure-v1-e0-u-caaf2d6d0a00a31f-735c2cf8ab3715aa","expected_artifact_paths_sha256":"a8a117986e58ee26cc28cd1446516b398056d8844c657aef120e191e0978c0c2","expected_publication_order_sha256":"e22997ba9dff7a1cf31f3d02c09e9b368a8be575e4c5aa36bfd39147df0b01d1","experiment_id":"closure_v1","gate":"E0-U","git_remote_url":"https://github.com/ejherran/lentic-pipe.git","h_commit":"9e66478d7c071067a750e7dd9a6a318fa93a2c88","h_scope":[{"bytes":6692,"mode":"100644","path":".gitignore","sha256":"94f9b47fc8919f419f0820e890d25b2119f763bade07e58592f41c45535355f2","status":"M"},{"bytes":12514,"mode":"100644","path":"configs/closure_v1/closure_e0_u_activation.schema.json","sha256":"979383e923a0a5182dcad439e2502d879a99b69e14f459018a44a21d9a8934d1","status":"A"},{"bytes":17062,"mode":"100644","path":"docs/closure_v1/E0_U_PHASE3_SEALED_BATCH.md","sha256":"959aa05741e56ba68bbb9cc53fb7dad3baa08fe089096be86bdcba3c80939c34","status":"A"},{"bytes":722491,"mode":"100755","path":"src/data/prepare_commit_artifacts.py","sha256":"9b9beae5cd2cd398aa340370655e0df5d9a2165b369d9e95b82a84eecb14d8d8","status":"M"},{"bytes":72569,"mode":"100644","path":"src/experiments/audit_closure_p0_model_availability.py","sha256":"be56e0837610f7686d0c16fdfdec6a98663decd1ba59022931cd4a503988ffcf","status":"M"},{"bytes":292963,"mode":"100644","path":"src/experiments/build_closure_e10_source_evidence.py","sha256":"814499a888fd125e2c19129d741a0891c31d36e5ce7d2392a32634cc0dec92d6","status":"A"},{"bytes":113381,"mode":"100644","path":"src/experiments/build_closure_phase3_input_overlay.py","sha256":"65576d5f4bc52331bce007abcdf062ebd1dcec37cfde8ccac81d3aabec218fc1","status":"A"},{"bytes":14063,"mode":"100644","path":"src/experiments/build_trophic_reference_targets.py","sha256":"4979ce13c9c83e03f398fac15e32f0a05900ae4a720af98c169f3f1e144c1e4e","status":"M"},{"bytes":40418,"mode":"100644","path":"src/experiments/calibrate_uncertainty_closure.py","sha256":"cf5aca141db87b2377fab21aaac71212e7b654026d6bfeaa5968a16685ab84f2","status":"M"},{"bytes":158838,"mode":"100644","path":"src/experiments/closure_e0_u_authority.py","sha256":"c0d5021ed866a507e06b67656bb489cf326e3dd3b24995c25ede04b6873fb1b3","status":"A"},{"bytes":110382,"mode":"100644","path":"src/experiments/closure_phase3_context.py","sha256":"550b0796f23bb9bf73bc7c6e6d4c74061951b67e1cc493d2dbc2d328e3e17745","status":"A"},{"bytes":16946,"mode":"100644","path":"src/experiments/compare_models_clustered.py","sha256":"3030b10743976275a7d0f85d110e4d74e0833c871232dcaed28163123be99b63","status":"M"},{"bytes":33021,"mode":"100644","path":"src/experiments/evaluate_anfis_ablation.py","sha256":"f7e8ac12d1f3dceaa12c352e7ddd4928fbfa15e9c6e2214bf43e5e352527ec27","status":"M"},{"bytes":35447,"mode":"100644","path":"src/experiments/evaluate_matched_degradation.py","sha256":"7a767ae6550eb795367eac4dc5ec85c45e59239b1a40951fe7102befa6c6140f","status":"M"},{"bytes":36551,"mode":"100644","path":"src/experiments/evaluate_planning_inference.py","sha256":"e565c4f635c5923d930a1c4310a620587681952a3d7327c700e76696aa316892","status":"M"},{"bytes":28379,"mode":"100644","path":"src/experiments/evaluate_site_transfer.py","sha256":"40b1dabebc4aff81436d60930fb718c32e2c7e0cd89a5510cb092953ca9cb74b","status":"M"},{"bytes":39070,"mode":"100644","path":"src/experiments/evaluate_threshold_sensitivity.py","sha256":"973d5cdfde4905403e1a612c30ec0874b591bceb818182c41c2856ca0af53623","status":"M"},{"bytes":27606,"mode":"100644","path":"src/experiments/evaluate_trophic_state.py","sha256":"7fb54347289fade4534f9932474a77c31b5ccbb237b59383169f49ea041e2c7a","status":"M"},{"bytes":86625,"mode":"100644","path":"src/experiments/lock_closure_e0_u_activation.py","sha256":"e1a6bd66cff5ef39d831844ae27363df9fce117f9c354792a1de5e7e69b6fb60","status":"A"},{"bytes":257643,"mode":"100644","path":"src/experiments/run_closure_benchmark.py","sha256":"e70b7181c766a9cdec8d0cec24639a4ff5150fad609945f1a2205a588ea3f77f","status":"M"},{"bytes":29227,"mode":"100644","path":"src/reporting/build_closure_evidence_matrix.py","sha256":"e545c8ecac933bfc65acd6e74189b32ef49a3a894e8f7dbf591e406e80190cee","status":"M"},{"bytes":40312,"mode":"100644","path":"tests/test_audit_closure_p0_model_availability.py","sha256":"9ca8b89769c9a16dfc778d546eb4c27535f7a51e78f82b5ef5e88d6bb9d10784","status":"M"},{"bytes":25735,"mode":"100644","path":"tests/test_audit_closure_p0_sequence_bundle.py","sha256":"a5382daade4c48db1f3c34db11a6e10be356f974935107a5e0de943653d456dc","status":"M"},{"bytes":124025,"mode":"100644","path":"tests/test_build_closure_e10_source_evidence.py","sha256":"f3551bb892fa2bd278d32cf90fb3a2e27ae168f2bc3238cc7d38711460f66917","status":"A"},{"bytes":57117,"mode":"100644","path":"tests/test_closure_anfis_ablation_dvc_registration_adoption_patch.py","sha256":"3129071f7b522e9ab26bb05e997fd03246be9ddfeed391fff0ea6e5b935e02a6","status":"M"},{"bytes":83130,"mode":"100644","path":"tests/test_closure_anfis_ablation_dvc_registration_gitignore_patch.py","sha256":"f9c3172466d0175110e6fb8df0441e680002d67c3bc2c7121e78242883eea646","status":"M"},{"bytes":73153,"mode":"100644","path":"tests/test_closure_anfis_ablation_dvc_registration_namespace_patch.py","sha256":"0de7927c1e8a07dc8b7cf9cd04a0a4661b29c71d501e8f668df0b37c7dd73f6d","status":"M"},{"bytes":62590,"mode":"100644","path":"tests/test_closure_anfis_ablation_dvc_registration_order_patch.py","sha256":"9df4d1738b629331f1f9b9b39836265469d3e0eca298eb8d0212ea4c4b4adadb","status":"M"},{"bytes":96880,"mode":"100644","path":"tests/test_closure_anfis_ablation_dvc_registration_reproducibility_patch.py","sha256":"264a832e7519bd2a3839425e314066044fba1b4a1267d96623b61d40598d8929","status":"M"},{"bytes":91599,"mode":"100644","path":"tests/test_closure_anfis_ablation_dvc_registration_status_patch.py","sha256":"5f1ff3fce577c74fb3b07884c2c8bd0ec4a27d9fe85e73e5e6671fd64f6483a9","status":"M"},{"bytes":76161,"mode":"100644","path":"tests/test_closure_anfis_ablation_model_publication_adoption_patch.py","sha256":"862a418ea091129bc4147f402ad38d3b6f6b6692feb6b512a8b06e81cb455cb8","status":"M"},{"bytes":38248,"mode":"100644","path":"tests/test_closure_e0_u_activation_lock.py","sha256":"5fe29fb0b65af14f35bff2b7ae7bc50ccb9bf91e10f313f8f0305a8139899fbc","status":"A"},{"bytes":84569,"mode":"100644","path":"tests/test_closure_e0_u_authority.py","sha256":"35c4b1a3ffa32b198720ef4b604128540849683e1ec54c4e49dbf75da42a914d","status":"A"},{"bytes":8783,"mode":"1006